key,title,tip,tip2
danseitokken,男性特権,男性特権とは、家父長制的な社会構造の中で、男性がマジョリティ（優位）側の属性を持つことにより、意識せずとも自動的に享受している相対的な利点や安全性のこと。昇進の機会、夜間の安全性、家事・育児の負担軽減など、女性やマイノリティと比較して有利な環境に置かれる状況を指す。 ,
microaggression,マイクロアグレッション,マイクロアグレッションとは、人種、性別、性的指向、障害などの属性に基づき、日常生活で無意識かつ悪気なく発せられる「小さな（Micro）」差別的な言葉や態度のこと。一見すると褒め言葉や軽い冗談に見えることもあるが、受け手には否定的なメッセージや固定観念として伝わり、心理的ストレスを累積させる「見えない攻撃」として近年問題視されている。 ,
malegaze,メイルゲイズ,メイルゲイズ（Male Gaze：男性の視線）とは、映画や広告などの視覚メディアにおいて、女性が男性の視点（欲望の対象）として受動的に描かれる構造を指す。,
saferspace,セーファースペース,セーファースペースとは、性別、性的指向、人種、障害、年齢などに関わらず、すべての人が差別やハラスメントを恐れずに「自分らしく」いられ、互いに敬意を持って交流できる「より安全な空間」のこと。既存の社会で周縁化されやすい人々が、安心して過ごせる場（カフェやイベントなど）を作るための意識的な試みや、その場でのルールを指す。 ,
Mansplaining,マンスプレイング,マンスプレイニング（Mansplaining）とは、男性（Man）が説明する（Explaining）の造語で、男性が女性に対して無意識に見下した態度や、上から目線で知識をひけらかし、説明・解説する行為を指す。相手がその分野に詳しいかどうかにかかわらず、教えようとする姿勢が特徴である。 ,